{"$defs":{"nullableInteger":{"type":["integer","null"]},"nullableString":{"type":["string","null"]},"px":{"additionalProperties":false,"properties":{"L":{"items":{"type":"number"},"maxItems":6,"minItems":6,"type":"array"},"R":{"items":{"type":"number"},"maxItems":6,"minItems":6,"type":"array"},"ar":{"type":"number"},"g":{"items":{"type":"number"},"maxItems":2,"minItems":2,"type":"array"},"s":{"minLength":1,"type":"string"}},"required":["s","L","R","g","ar"],"type":"object"}},"$id":"https://claytations-props.github.io/stereogram-archive/schema/catalog-v2.schema.json","$schema":"https://json-schema.org/draft/2020-12/schema","additionalProperties":false,"description":"One v2 record per item, stored at records/STA-####.json; records/ is the catalog of record since Phase 1 (docs/ARCHIVE_POLICY.md). data.json and catalog-v2.json are generated from records/ by tools/build_catalog.py. The first 24 properties are the v1 fields (schema/catalog.schema.json); the rest are the Phase 1 additions. Field meanings and derivation rules: docs/DATA_DICTIONARY.md.","properties":{"blurb":{"type":"string"},"cats":{"items":{"enum":["water","mountains","cities","war","world","people","oddities"]},"minItems":1,"type":"array"},"coll":{"minLength":1,"type":"string"},"collection_name":{"$ref":"#/$defs/nullableString"},"cond":{"minLength":1,"type":"string"},"creator":{"$ref":"#/$defs/nullableString"},"creator_dates":{"$ref":"#/$defs/nullableString"},"date_edtf":{"$ref":"#/$defs/nullableString"},"date_end":{"$ref":"#/$defs/nullableInteger"},"date_start":{"$ref":"#/$defs/nullableInteger"},"depth":{"enum":["Gentle","Moderate","Deep"]},"era":{"enum":["early","mid","late","undated"]},"f":{"type":"number"},"facets":{"items":{"enum":["water","mountains","cities","war","world","people","oddities"]},"minItems":1,"type":"array"},"full":{"minLength":1,"type":"string"},"h":{"minimum":1,"type":"integer"},"id":{"pattern":"^STA-\\d{4}$","type":"string"},"img":{"minLength":1,"type":"string"},"license":{"enum":["Public domain","No restrictions","CC0"]},"license_url":{"pattern":"^https?://","type":["string","null"]},"place":{"minLength":1,"type":"string"},"publisher":{"$ref":"#/$defs/nullableString"},"publisher_series":{"$ref":"#/$defs/nullableString"},"px":{"$ref":"#/$defs/px"},"range":{"type":"number"},"rect":{"pattern":"^rect/\\d+\\.jpg$","type":"string"},"repository":{"$ref":"#/$defs/nullableString"},"rights_basis":{"minLength":1,"type":"string"},"rights_uri":{"pattern":"^https?://","type":["string","null"]},"rot":{"type":"number"},"source":{"minLength":1,"type":"string"},"source_page_id":{"$ref":"#/$defs/nullableInteger"},"source_revision_id":{"$ref":"#/$defs/nullableInteger"},"source_sha1":{"pattern":"^[0-9a-f]{40}$","type":["string","null"]},"sy":{"type":"integer"},"title":{"minLength":1,"type":"string"},"va":{"type":"number"},"vert":{"type":"number"},"w":{"minimum":1,"type":"integer"},"year":{"minLength":1,"type":"string"}},"required":["title","place","year","sy","era","cats","blurb","img","full","source","license","w","h","id","rect","coll","vert","rot","range","f","depth","va","px","cond","repository","collection_name","publisher","creator","creator_dates","facets","publisher_series","date_edtf","date_start","date_end","rights_uri","rights_basis","license_url","source_page_id","source_revision_id","source_sha1"],"title":"Stereograph Archive catalog, schema v2 (per-item record)","type":"object"}