{
 "title": "173 ny. Frederik Prytz's Familie - NB bldsa OTO0511 A",
 "place": "Norway",
 "year": "1860",
 "sy": 1860,
 "era": "early",
 "cats": [
  "people",
  "world"
 ],
 "blurb": "Stereoskopi Sted: Kommune: Fylke: Tagger:",
 "img": "https://thumb.wikimedia.org/wikipedia/commons/thumb/0/03/173_ny._Frederik_Prytz%27s_Familie_-_NB_bldsa_OTO0511_A.jpg/1920px-173_ny._Frederik_Prytz%27s_Familie_-_NB_bldsa_OTO0511_A.jpg?utm_source=commons.wikimedia.org&utm_campaign=imageinfo&utm_content=thumbnail",
 "full": "https://upload.wikimedia.org/wikipedia/commons/0/03/173_ny._Frederik_Prytz%27s_Familie_-_NB_bldsa_OTO0511_A.jpg?utm_source=commons.wikimedia.org&utm_campaign=imageinfo&utm_content=original",
 "source": "https://commons.wikimedia.org/wiki/File:173_ny._Frederik_Prytz%27s_Familie_-_NB_bldsa_OTO0511_A.jpg",
 "license": "Public domain",
 "w": 7802,
 "h": 6483,
 "id": "STA-0952",
 "rect": "rect/951.jpg",
 "coll": "Source unrecorded",
 "vert": 0.12,
 "rot": 0.01,
 "range": 1.23,
 "f": 1.0,
 "depth": "Gentle",
 "va": 1.4562,
 "px": {
  "s": "https://thumb.wikimedia.org/wikipedia/commons/thumb/0/03/173_ny._Frederik_Prytz%27s_Familie_-_NB_bldsa_OTO0511_A.jpg/1920px-173_ny._Frederik_Prytz%27s_Familie_-_NB_bldsa_OTO0511_A.jpg?utm_source=commons.wikimedia.org&utm_campaign=imageinfo&utm_content=thumbnail",
  "ar": 1.4562,
  "L": [
   0.380729,
   0.0,
   0.071094,
   0.0,
   0.314734,
   0.326332
  ],
  "R": [
   0.379107,
   0.002707,
   0.509783,
   -0.000166,
   0.312865,
   0.328462
  ],
  "g": [
   0.9289,
   1.0
  ]
 },
 "cond": "Rectified 2026. Halves registered to 0.12% vertical error and 0.01° of rotation. Depth measured gentle (1.23% of frame width); hung in the VR Parlor at full size.",
 "repository": null,
 "collection_name": null,
 "publisher": null,
 "creator": null,
 "creator_dates": null,
 "facets": [
  "people",
  "world"
 ],
 "publisher_series": null,
 "date_edtf": "1860",
 "date_start": 1860,
 "date_end": 1860,
 "rights_uri": "https://rightsstatements.org/vocab/NoC-US/1.0/",
 "rights_basis": "Source record marks the work public domain (Wikimedia Commons license short name: Public domain). Rights URI assigned by rule: RightsStatements.org No Copyright - United States (NoC-US).",
 "license_url": null,
 "source_page_id": 32619958,
 "source_revision_id": null,
 "source_sha1": "3c015db977ea80b963212c7be2b967e4bc3ac1d7"
}
