{
 "title": "Ingang van een kloof nabij Pfäfers, Zwitserland Entrée de la gorge de Pfaeffers (titel op object) Suisse (serietitel op object), RP-F-F07904",
 "place": "Switzerland",
 "year": "1879–1889",
 "sy": 1879,
 "era": "mid",
 "cats": [
  "mountains",
  "world"
 ],
 "blurb": "Identificatie Titel(s): Ingang van een kloof nabij Pfäfers, Zwitserland. Entrée de la gorge de Pfaeffers. (titel op object) Suisse. (serietitel op object) Objecttype: stereofoto Objectnummer: RP-F-F07904 Opschriften / Merken: nummer, verso, gedrukt: ‘No 6147.’ Omschrijving: Mogelijk de Taminakloof. Vervaardiging Vervaardiger: fotograaf: anoniem, uitgever: Adolphe Braun et Cie (vermeld op object) Plaats vervaardiging: fotograaf: Pfäfers, uitgever: Dornach Datering: 1879 - 1889 Materiaal: karton fotopapier Techniek: albuminedruk Afmetingen: secundaire drager: h 85 mm × b 175 mm Onderwerp Wat: mountains, ravine, chasm, abyss, canyon Waar: Pfäfers Verwerving en rechten Verwerving: overdracht van beheer 1994 Copyright: Publiek domein",
 "img": "https://thumb.wikimedia.org/wikipedia/commons/thumb/c/c7/Ingang_van_een_kloof_nabij_Pf%C3%A4fers%2C_Zwitserland_Entr%C3%A9e_de_la_gorge_de_Pfaeffers_%28titel_op_object%29_Suisse_%28serietitel_op_object%29%2C_RP-F-F07904.jpg/1920px-Ingang_van_een_kloof_nabij_Pf%C3%A4fers%2C_Zwitserland_Entr%C3%A9e_de_la_gorge_de_Pfaeffers_%28titel_op_object%29_Suisse_%28serietitel_op_object%29%2C_RP-F-F07904.jpg?utm_source=commons.wikimedia.org&utm_campaign=imageinfo&utm_content=thumbnail",
 "full": "https://upload.wikimedia.org/wikipedia/commons/c/c7/Ingang_van_een_kloof_nabij_Pf%C3%A4fers%2C_Zwitserland_Entr%C3%A9e_de_la_gorge_de_Pfaeffers_%28titel_op_object%29_Suisse_%28serietitel_op_object%29%2C_RP-F-F07904.jpg?utm_source=commons.wikimedia.org&utm_campaign=imageinfo&utm_content=original",
 "source": "https://commons.wikimedia.org/wiki/File:Ingang_van_een_kloof_nabij_Pf%C3%A4fers,_Zwitserland_Entr%C3%A9e_de_la_gorge_de_Pfaeffers_(titel_op_object)_Suisse_(serietitel_op_object),_RP-F-F07904.jpg",
 "license": "CC0",
 "w": 4408,
 "h": 2234,
 "id": "STA-1021",
 "rect": "rect/1020.jpg",
 "coll": "Rijksmuseum",
 "vert": 0.16,
 "rot": 0.1,
 "range": 0.82,
 "f": 1.0,
 "depth": "Gentle",
 "va": 0.7726,
 "px": {
  "s": "https://thumb.wikimedia.org/wikipedia/commons/thumb/c/c7/Ingang_van_een_kloof_nabij_Pf%C3%A4fers%2C_Zwitserland_Entr%C3%A9e_de_la_gorge_de_Pfaeffers_%28titel_op_object%29_Suisse_%28serietitel_op_object%29%2C_RP-F-F07904.jpg/1920px-Ingang_van_een_kloof_nabij_Pf%C3%A4fers%2C_Zwitserland_Entr%C3%A9e_de_la_gorge_de_Pfaeffers_%28titel_op_object%29_Suisse_%28serietitel_op_object%29%2C_RP-F-F07904.jpg?utm_source=commons.wikimedia.org&utm_campaign=imageinfo&utm_content=thumbnail",
  "ar": 0.7726,
  "L": [
   0.346875,
   0.0,
   0.146094,
   0.0,
   0.88592,
   0.065262
  ],
  "R": [
   0.348487,
   0.00264,
   0.51786,
   -9.4e-05,
   0.887472,
   0.059112
  ],
  "g": [
   0.9804,
   1.0
  ]
 },
 "cond": "Rectified 2026. Halves registered to 0.16% vertical error and 0.1° of rotation. Depth measured gentle (0.82% of frame width); hung in the VR Parlor at full size.",
 "repository": "Rijksmuseum",
 "collection_name": null,
 "publisher": null,
 "creator": null,
 "creator_dates": null,
 "facets": [
  "mountains",
  "world"
 ],
 "publisher_series": null,
 "date_edtf": "1879/1889",
 "date_start": 1879,
 "date_end": 1889,
 "rights_uri": "https://creativecommons.org/publicdomain/zero/1.0/",
 "rights_basis": "Source record carries a CC0 dedication (Wikimedia Commons license short name: CC0). Rights URI is the CC0 deed URL recorded from the source page.",
 "license_url": null,
 "source_page_id": 85219646,
 "source_revision_id": null,
 "source_sha1": "097ec779c40964a2c29fa430fdee14e30c3b51ef"
}
