{
 "title": "Mauch Chunk, Pennsylvania, from Robert N. Dennis collection of stereoscopic views 6",
 "place": "Mauch Chunk, Pennsylvania",
 "year": "1859–1885",
 "sy": 1859,
 "era": "early",
 "cats": [
  "cities"
 ],
 "blurb": "",
 "img": "https://thumb.wikimedia.org/wikipedia/commons/thumb/d/d4/Mauch_Chunk%2C_Pennsylvania%2C_from_Robert_N._Dennis_collection_of_stereoscopic_views_6.jpg/1920px-Mauch_Chunk%2C_Pennsylvania%2C_from_Robert_N._Dennis_collection_of_stereoscopic_views_6.jpg?utm_source=commons.wikimedia.org&utm_campaign=imageinfo&utm_content=thumbnail",
 "full": "https://upload.wikimedia.org/wikipedia/commons/d/d4/Mauch_Chunk%2C_Pennsylvania%2C_from_Robert_N._Dennis_collection_of_stereoscopic_views_6.jpg?utm_source=commons.wikimedia.org&utm_campaign=imageinfo&utm_content=original",
 "source": "https://commons.wikimedia.org/wiki/File:Mauch_Chunk,_Pennsylvania,_from_Robert_N._Dennis_collection_of_stereoscopic_views_6.jpg",
 "license": "Public domain",
 "w": 2737,
 "h": 1413,
 "id": "STA-1108",
 "rect": "rect/1107.jpg",
 "coll": "Robert N. Dennis Collection",
 "vert": 0.09,
 "rot": 0.02,
 "range": 1.32,
 "f": 1.0,
 "depth": "Gentle",
 "va": 0.8285,
 "px": {
  "s": "https://thumb.wikimedia.org/wikipedia/commons/thumb/d/d4/Mauch_Chunk%2C_Pennsylvania%2C_from_Robert_N._Dennis_collection_of_stereoscopic_views_6.jpg/1920px-Mauch_Chunk%2C_Pennsylvania%2C_from_Robert_N._Dennis_collection_of_stereoscopic_views_6.jpg?utm_source=commons.wikimedia.org&utm_campaign=imageinfo&utm_content=thumbnail",
  "ar": 0.8285,
  "L": [
   0.354687,
   0.0,
   0.128385,
   0.0,
   0.829465,
   0.134712
  ],
  "R": [
   0.353949,
   -0.004635,
   0.574238,
   0.006153,
   0.830894,
   0.11804
  ],
  "g": [
   1.0,
   0.9207
  ]
 },
 "cond": "Rectified 2026. Halves registered to 0.09% vertical error and 0.02° of rotation. Depth measured gentle (1.32% of frame width); hung in the VR Parlor at full size.",
 "repository": "New York Public Library",
 "collection_name": "Robert N. Dennis Collection of Stereoscopic Views",
 "publisher": null,
 "creator": null,
 "creator_dates": null,
 "facets": [
  "cities"
 ],
 "publisher_series": null,
 "date_edtf": "1859/1885",
 "date_start": 1859,
 "date_end": 1885,
 "rights_uri": "https://rightsstatements.org/vocab/NoC-US/1.0/",
 "rights_basis": "Source record marks the work public domain (Wikimedia Commons license short name: Public domain). Rights URI assigned by rule: RightsStatements.org No Copyright - United States (NoC-US).",
 "license_url": null,
 "source_page_id": 7482654,
 "source_revision_id": null,
 "source_sha1": "70d3ce28747477b2240040e8798a8dd2e5d97e18"
}
