{
 "title": "Gezicht op de Pissevache-waterval Cascade de Pisse-Vache, a Vernayaz, pres Martigny (titel op object) La Suisse et la Savoie (serietitel), RP-F-F06447",
 "place": "Switzerland",
 "year": "c. 1860",
 "sy": 1860,
 "era": "early",
 "cats": [
  "water",
  "world"
 ],
 "blurb": "Identificatie Titel(s): Gezicht op de Pissevache-waterval. Cascade de Pisse-Vache, a Vernayaz, pres Martigny (titel op object). La Suisse et la Savoie (serietitel) Objecttype: stereofoto Objectnummer: RP-F-F06447 Opschriften / Merken: nummer, recto, gedrukt: ‘48.’ Vervaardiging Vervaardiger: fotograaf: Ernest Eléonor Pierre Lamy (vermeld op object) Plaats vervaardiging: Wallis Datering: ca. 1860 - ca. 1880 Materiaal: karton fotopapier Techniek: albuminedruk Afmetingen: secundaire drager: h 85 mm × b 170 mm Onderwerp Wat: waterfall Verwerving en rechten Verwerving: overdracht van beheer 1994 Copyright: Publiek domein",
 "img": "https://thumb.wikimedia.org/wikipedia/commons/thumb/5/55/Gezicht_op_de_Pissevache-waterval_Cascade_de_Pisse-Vache%2C_a_Vernayaz%2C_pres_Martigny_%28titel_op_object%29_La_Suisse_et_la_Savoie_%28serietitel%29%2C_RP-F-F06447.jpg/1920px-Gezicht_op_de_Pissevache-waterval_Cascade_de_Pisse-Vache%2C_a_Vernayaz%2C_pres_Martigny_%28titel_op_object%29_La_Suisse_et_la_Savoie_%28serietitel%29%2C_RP-F-F06447.jpg?utm_source=commons.wikimedia.org&utm_campaign=imageinfo&utm_content=thumbnail",
 "full": "https://upload.wikimedia.org/wikipedia/commons/5/55/Gezicht_op_de_Pissevache-waterval_Cascade_de_Pisse-Vache%2C_a_Vernayaz%2C_pres_Martigny_%28titel_op_object%29_La_Suisse_et_la_Savoie_%28serietitel%29%2C_RP-F-F06447.jpg?utm_source=commons.wikimedia.org&utm_campaign=imageinfo&utm_content=original",
 "source": "https://commons.wikimedia.org/wiki/File:Gezicht_op_de_Pissevache-waterval_Cascade_de_Pisse-Vache,_a_Vernayaz,_pres_Martigny_(titel_op_object)_La_Suisse_et_la_Savoie_(serietitel),_RP-F-F06447.jpg",
 "license": "CC0",
 "w": 4948,
 "h": 2464,
 "id": "STA-1007",
 "rect": "rect/1006.jpg",
 "coll": "Rijksmuseum",
 "vert": 0.11,
 "rot": 0.01,
 "range": 0.35,
 "f": 1.0,
 "depth": "Gentle",
 "va": 0.9067,
 "px": {
  "s": "https://thumb.wikimedia.org/wikipedia/commons/thumb/5/55/Gezicht_op_de_Pissevache-waterval_Cascade_de_Pisse-Vache%2C_a_Vernayaz%2C_pres_Martigny_%28titel_op_object%29_La_Suisse_et_la_Savoie_%28serietitel%29%2C_RP-F-F06447.jpg/1920px-Gezicht_op_de_Pissevache-waterval_Cascade_de_Pisse-Vache%2C_a_Vernayaz%2C_pres_Martigny_%28titel_op_object%29_La_Suisse_et_la_Savoie_%28serietitel%29%2C_RP-F-F06447.jpg?utm_source=commons.wikimedia.org&utm_campaign=imageinfo&utm_content=thumbnail",
  "ar": 0.9067,
  "L": [
   0.364583,
   0.0,
   0.129427,
   0.0,
   0.807531,
   0.094665
  ],
  "R": [
   0.366388,
   -0.006843,
   0.514585,
   0.009045,
   0.807818,
   0.091392
  ],
  "g": [
   0.9869,
   1.0
  ]
 },
 "cond": "Rectified 2026. Halves registered to 0.11% vertical error and 0.01° of rotation. Depth measured gentle (0.35% of frame width); hung in the VR Parlor at full size.",
 "repository": "Rijksmuseum",
 "collection_name": null,
 "publisher": null,
 "creator": null,
 "creator_dates": null,
 "facets": [
  "water",
  "world"
 ],
 "publisher_series": null,
 "date_edtf": "1860~",
 "date_start": 1855,
 "date_end": 1865,
 "rights_uri": "https://creativecommons.org/publicdomain/zero/1.0/",
 "rights_basis": "Source record carries a CC0 dedication (Wikimedia Commons license short name: CC0). Rights URI is the CC0 deed URL recorded from the source page.",
 "license_url": null,
 "source_page_id": 85083298,
 "source_revision_id": null,
 "source_sha1": "1b3e37d10d37a115ceaac98f784eac3f786aeaf0"
}
