{
 "title": "Cliff House, San Francisco, Cal. Seal Rocks in the distance (NYPL b11707327-G89F405 019F)",
 "place": "San Francisco, California",
 "year": "1869",
 "sy": 1869,
 "era": "early",
 "cats": [
  "mountains"
 ],
 "blurb": "",
 "img": "https://thumb.wikimedia.org/wikipedia/commons/thumb/b/bb/Cliff_House%2C_San_Francisco%2C_Cal._Seal_Rocks_in_the_distance_%28NYPL_b11707327-G89F405_019F%29.tiff/lossy-page1-1920px-Cliff_House%2C_San_Francisco%2C_Cal._Seal_Rocks_in_the_distance_%28NYPL_b11707327-G89F405_019F%29.tiff.jpg?utm_source=commons.wikimedia.org&utm_campaign=imageinfo&utm_content=thumbnail",
 "full": "https://upload.wikimedia.org/wikipedia/commons/b/bb/Cliff_House%2C_San_Francisco%2C_Cal._Seal_Rocks_in_the_distance_%28NYPL_b11707327-G89F405_019F%29.tiff?utm_source=commons.wikimedia.org&utm_campaign=imageinfo&utm_content=original",
 "source": "https://commons.wikimedia.org/wiki/File:Cliff_House,_San_Francisco,_Cal._Seal_Rocks_in_the_distance_(NYPL_b11707327-G89F405_019F).tiff",
 "license": "Public domain",
 "w": 3072,
 "h": 1741,
 "id": "STA-0525",
 "rect": "rect/524.jpg",
 "coll": "Robert N. Dennis Collection",
 "vert": 0.18,
 "rot": 0.0,
 "range": 0.95,
 "f": 1.0,
 "depth": "Gentle",
 "va": 1.6436,
 "px": {
  "s": "https://thumb.wikimedia.org/wikipedia/commons/thumb/b/bb/Cliff_House%2C_San_Francisco%2C_Cal._Seal_Rocks_in_the_distance_%28NYPL_b11707327-G89F405_019F%29.tiff/lossy-page1-1920px-Cliff_House%2C_San_Francisco%2C_Cal._Seal_Rocks_in_the_distance_%28NYPL_b11707327-G89F405_019F%29.tiff.jpg?utm_source=commons.wikimedia.org&utm_campaign=imageinfo&utm_content=thumbnail",
  "ar": 1.6436,
  "L": [
   0.345833,
   0.0,
   0.128906,
   0.0,
   0.371324,
   0.573989
  ],
  "R": [
   0.343703,
   -0.001858,
   0.507482,
   -0.011283,
   0.372349,
   0.573055
  ],
  "g": [
   1.0,
   0.9418
  ]
 },
 "cond": "Rectified 2026. Halves registered to 0.18% vertical error and 0.0° of rotation. Depth measured gentle (0.95% of frame width); hung in the VR Parlor at full size.",
 "repository": "New York Public Library",
 "collection_name": "Robert N. Dennis Collection of Stereoscopic Views",
 "publisher": null,
 "creator": null,
 "creator_dates": null,
 "facets": [
  "mountains"
 ],
 "publisher_series": null,
 "date_edtf": "1869",
 "date_start": 1869,
 "date_end": 1869,
 "rights_uri": "https://rightsstatements.org/vocab/NoC-US/1.0/",
 "rights_basis": "Source record marks the work public domain (Wikimedia Commons license short name: Public domain). Rights URI assigned by rule: RightsStatements.org No Copyright - United States (NoC-US).",
 "license_url": null,
 "source_page_id": 47029706,
 "source_revision_id": null,
 "source_sha1": "f2d221029ae9f7ef395466ef9f7aea3fa395c15a"
}
