{
 "title": "Dale Hospital",
 "place": "Place unrecorded",
 "year": "1870",
 "sy": 1870,
 "era": "mid",
 "cats": [
  "oddities"
 ],
 "blurb": "",
 "img": "https://thumb.wikimedia.org/wikipedia/commons/thumb/7/74/Dale_Hospital%2C_from_Robert_N._Dennis_collection_of_stereoscopic_views.jpg/1920px-Dale_Hospital%2C_from_Robert_N._Dennis_collection_of_stereoscopic_views.jpg?utm_source=commons.wikimedia.org&utm_campaign=imageinfo&utm_content=thumbnail",
 "full": "https://upload.wikimedia.org/wikipedia/commons/7/74/Dale_Hospital%2C_from_Robert_N._Dennis_collection_of_stereoscopic_views.jpg?utm_source=commons.wikimedia.org&utm_campaign=imageinfo&utm_content=original",
 "source": "https://commons.wikimedia.org/wiki/File:Dale_Hospital,_from_Robert_N._Dennis_collection_of_stereoscopic_views.jpg",
 "license": "Public domain",
 "w": 2737,
 "h": 1430,
 "id": "STA-1049",
 "rect": "rect/1048.jpg",
 "coll": "Robert N. Dennis Collection",
 "vert": 0.27,
 "rot": 0.06,
 "range": 0.53,
 "f": 1.0,
 "depth": "Gentle",
 "va": 2.0177,
 "px": {
  "s": "https://thumb.wikimedia.org/wikipedia/commons/thumb/7/74/Dale_Hospital%2C_from_Robert_N._Dennis_collection_of_stereoscopic_views.jpg/1920px-Dale_Hospital%2C_from_Robert_N._Dennis_collection_of_stereoscopic_views.jpg?utm_source=commons.wikimedia.org&utm_campaign=imageinfo&utm_content=thumbnail",
  "ar": 2.0177,
  "L": [
   0.35625,
   0.0,
   0.13724,
   0.0,
   0.337986,
   0.22682
  ],
  "R": [
   0.356585,
   -0.001187,
   0.511498,
   0.001436,
   0.338058,
   0.232238
  ],
  "g": [
   0.9355,
   1.0
  ]
 },
 "cond": "Rectified 2026. Halves registered to 0.27% vertical error and 0.06° of rotation. Depth measured gentle (0.53% of frame width); hung in the VR Parlor at full size.",
 "repository": "New York Public Library",
 "collection_name": "Robert N. Dennis Collection of Stereoscopic Views",
 "publisher": null,
 "creator": null,
 "creator_dates": null,
 "facets": [
  "oddities"
 ],
 "publisher_series": null,
 "date_edtf": "1870",
 "date_start": 1870,
 "date_end": 1870,
 "rights_uri": "https://rightsstatements.org/vocab/NoC-US/1.0/",
 "rights_basis": "Source record marks the work public domain (Wikimedia Commons license short name: Public domain). Rights URI assigned by rule: RightsStatements.org No Copyright - United States (NoC-US).",
 "license_url": null,
 "source_page_id": 7448212,
 "source_revision_id": null,
 "source_sha1": "a8460472c6bd069fc6f29a5922b6a5ad278db58b"
}
