{
 "title": "Anoka looking north, by F. A. Taylor",
 "place": "Minnesota",
 "year": "1869",
 "sy": 1869,
 "era": "early",
 "cats": [
  "oddities"
 ],
 "blurb": "",
 "img": "https://thumb.wikimedia.org/wikipedia/commons/thumb/6/6a/Anoka_looking_north%2C_by_F._A._Taylor.jpg/1920px-Anoka_looking_north%2C_by_F._A._Taylor.jpg?utm_source=commons.wikimedia.org&utm_campaign=imageinfo&utm_content=thumbnail",
 "full": "https://upload.wikimedia.org/wikipedia/commons/6/6a/Anoka_looking_north%2C_by_F._A._Taylor.jpg?utm_source=commons.wikimedia.org&utm_campaign=imageinfo&utm_content=original",
 "source": "https://commons.wikimedia.org/wiki/File:Anoka_looking_north,_by_F._A._Taylor.jpg",
 "license": "Public domain",
 "w": 2737,
 "h": 1442,
 "id": "STA-0266",
 "rect": "rect/265.jpg",
 "coll": "Source unrecorded",
 "vert": 0.16,
 "rot": 0.01,
 "range": 0.44,
 "f": 1.0,
 "depth": "Gentle",
 "va": 1.3381,
 "px": {
  "s": "https://thumb.wikimedia.org/wikipedia/commons/thumb/6/6a/Anoka_looking_north%2C_by_F._A._Taylor.jpg/1920px-Anoka_looking_north%2C_by_F._A._Taylor.jpg?utm_source=commons.wikimedia.org&utm_campaign=imageinfo&utm_content=thumbnail",
  "ar": 1.3381,
  "L": [
   0.391667,
   0.0,
   0.097656,
   0.0,
   0.555336,
   0.375
  ],
  "R": [
   0.390041,
   0.008352,
   0.505506,
   -0.026241,
   0.552383,
   0.375956
  ],
  "g": [
   0.9184,
   1.0
  ]
 },
 "cond": "Rectified 2026. Halves registered to 0.16% vertical error and 0.01° of rotation. Depth measured gentle (0.44% of frame width); hung in the VR Parlor at full size.",
 "repository": null,
 "collection_name": null,
 "publisher": null,
 "creator": "F. A. Taylor",
 "creator_dates": null,
 "facets": [
  "oddities"
 ],
 "publisher_series": null,
 "date_edtf": "1869",
 "date_start": 1869,
 "date_end": 1869,
 "rights_uri": "https://rightsstatements.org/vocab/NoC-US/1.0/",
 "rights_basis": "Source record marks the work public domain (Wikimedia Commons license short name: Public domain). Rights URI assigned by rule: RightsStatements.org No Copyright - United States (NoC-US).",
 "license_url": null,
 "source_page_id": 7464566,
 "source_revision_id": 1055043839,
 "source_sha1": "ba34d83fc261451585cfab7d28918eec45c4b72d"
}
