{
 "title": "Congress Hall, Saratoga, N.Y, from Robert N. Dennis collection of stereoscopic views 3",
 "place": "Saratoga Springs, New York",
 "year": "1869",
 "sy": 1869,
 "era": "early",
 "cats": [
  "cities"
 ],
 "blurb": "",
 "img": "https://thumb.wikimedia.org/wikipedia/commons/thumb/3/30/Congress_Hall%2C_Saratoga%2C_N.Y%2C_from_Robert_N._Dennis_collection_of_stereoscopic_views_3.jpg/1920px-Congress_Hall%2C_Saratoga%2C_N.Y%2C_from_Robert_N._Dennis_collection_of_stereoscopic_views_3.jpg?utm_source=commons.wikimedia.org&utm_campaign=imageinfo&utm_content=thumbnail",
 "full": "https://upload.wikimedia.org/wikipedia/commons/3/30/Congress_Hall%2C_Saratoga%2C_N.Y%2C_from_Robert_N._Dennis_collection_of_stereoscopic_views_3.jpg?utm_source=commons.wikimedia.org&utm_campaign=imageinfo&utm_content=original",
 "source": "https://commons.wikimedia.org/wiki/File:Congress_Hall,_Saratoga,_N.Y,_from_Robert_N._Dennis_collection_of_stereoscopic_views_3.jpg",
 "license": "Public domain",
 "w": 2669,
 "h": 1354,
 "id": "STA-0641",
 "rect": "rect/640.jpg",
 "coll": "Robert N. Dennis Collection",
 "vert": 0.15,
 "rot": 0.01,
 "range": 8.05,
 "f": 0.37,
 "depth": "Deep",
 "va": 1.088,
 "px": {
  "s": "https://thumb.wikimedia.org/wikipedia/commons/thumb/3/30/Congress_Hall%2C_Saratoga%2C_N.Y%2C_from_Robert_N._Dennis_collection_of_stereoscopic_views_3.jpg/1920px-Congress_Hall%2C_Saratoga%2C_N.Y%2C_from_Robert_N._Dennis_collection_of_stereoscopic_views_3.jpg?utm_source=commons.wikimedia.org&utm_campaign=imageinfo&utm_content=thumbnail",
  "ar": 1.088,
  "L": [
   0.341146,
   0.0,
   0.115365,
   0.0,
   0.61807,
   0.341376
  ],
  "R": [
   0.340241,
   -0.001527,
   0.50686,
   0.002602,
   0.616698,
   0.328975
  ],
  "g": [
   1.0,
   0.8913
  ]
 },
 "cond": "Rectified 2026. Halves registered to 0.15% vertical error and 0.01° of rotation. Depth measured deep (8.05% of frame width); hung in the VR Parlor at 37% size.",
 "repository": "New York Public Library",
 "collection_name": "Robert N. Dennis Collection of Stereoscopic Views",
 "publisher": null,
 "creator": null,
 "creator_dates": null,
 "facets": [
  "cities"
 ],
 "publisher_series": null,
 "date_edtf": "1869",
 "date_start": 1869,
 "date_end": 1869,
 "rights_uri": "https://rightsstatements.org/vocab/NoC-US/1.0/",
 "rights_basis": "Source record marks the work public domain (Wikimedia Commons license short name: Public domain). Rights URI assigned by rule: RightsStatements.org No Copyright - United States (NoC-US).",
 "license_url": null,
 "source_page_id": 10077578,
 "source_revision_id": null,
 "source_sha1": "9642a818271555f8a446e8e746595a94d3ef8f49"
}
