{
 "title": "Water Gap Pa. Kittatinny Mountains",
 "place": "Delaware Water Gap, Pennsylvania",
 "year": "1860",
 "sy": 1860,
 "era": "early",
 "cats": [
  "mountains"
 ],
 "blurb": "",
 "img": "https://thumb.wikimedia.org/wikipedia/commons/thumb/e/ec/Water_Gap_Pa._Kittatinny_Mountains%2C_from_Robert_N._Dennis_collection_of_stereoscopic_views.jpg/1920px-Water_Gap_Pa._Kittatinny_Mountains%2C_from_Robert_N._Dennis_collection_of_stereoscopic_views.jpg?utm_source=commons.wikimedia.org&utm_campaign=imageinfo&utm_content=thumbnail",
 "full": "https://upload.wikimedia.org/wikipedia/commons/e/ec/Water_Gap_Pa._Kittatinny_Mountains%2C_from_Robert_N._Dennis_collection_of_stereoscopic_views.jpg?utm_source=commons.wikimedia.org&utm_campaign=imageinfo&utm_content=original",
 "source": "https://commons.wikimedia.org/wiki/File:Water_Gap_Pa._Kittatinny_Mountains,_from_Robert_N._Dennis_collection_of_stereoscopic_views.jpg",
 "license": "Public domain",
 "w": 2695,
 "h": 1775,
 "id": "STA-0315",
 "rect": "rect/314.jpg",
 "coll": "Robert N. Dennis Collection",
 "vert": 0.07,
 "rot": 0.01,
 "range": 4.49,
 "f": 0.78,
 "depth": "Deep",
 "va": 0.9008,
 "px": {
  "s": "https://thumb.wikimedia.org/wikipedia/commons/thumb/e/ec/Water_Gap_Pa._Kittatinny_Mountains%2C_from_Robert_N._Dennis_collection_of_stereoscopic_views.jpg/1920px-Water_Gap_Pa._Kittatinny_Mountains%2C_from_Robert_N._Dennis_collection_of_stereoscopic_views.jpg?utm_source=commons.wikimedia.org&utm_campaign=imageinfo&utm_content=thumbnail",
  "ar": 0.9008,
  "L": [
   0.416146,
   0.0,
   0.073698,
   0.0,
   0.701186,
   0.250988
  ],
  "R": [
   0.414523,
   -0.005143,
   0.510824,
   -0.000511,
   0.700224,
   0.258928
  ],
  "g": [
   1.0,
   0.9986
  ]
 },
 "cond": "Rectified 2026. Halves registered to 0.07% vertical error and 0.01° of rotation. Depth measured deep (4.49% of frame width); hung in the VR Parlor at 78% size.",
 "repository": "New York Public Library",
 "collection_name": "Robert N. Dennis Collection of Stereoscopic Views",
 "publisher": null,
 "creator": null,
 "creator_dates": null,
 "facets": [
  "mountains"
 ],
 "publisher_series": null,
 "date_edtf": "1860",
 "date_start": 1860,
 "date_end": 1860,
 "rights_uri": "https://rightsstatements.org/vocab/NoC-US/1.0/",
 "rights_basis": "Source record marks the work public domain (Wikimedia Commons license short name: Public domain). Rights URI assigned by rule: RightsStatements.org No Copyright - United States (NoC-US).",
 "license_url": null,
 "source_page_id": 12018438,
 "source_revision_id": 295753906,
 "source_sha1": "20063e448cead4ee39d237baacb5b55a557ea970"
}
