{
 "title": "Stereofoto van het theater in Parijs Mignon transformée (titel op object), RP-F-2016-51-4",
 "place": "Paris, France",
 "year": "c. 1867",
 "sy": 1867,
 "era": "early",
 "cats": [
  "people",
  "world"
 ],
 "blurb": "Identificatie Titel(s): Stereofoto van het theater in Parijs. Mignon transformée (titel op object) Objecttype: stereofoto Objectnummer: RP-F-2016-51-4 Vervaardiging Vervaardiger: fotograaf: anoniem Plaats vervaardiging: Parijs Datering: ca. 1867 Fysieke kenmerken: albuminedruk Materiaal: karton fotopapier Techniek: albuminedruk Afmetingen: h 85 mm × b 170 mm Onderwerp Wat: group of actors, troupe; actors on the stage Waar: Parijs Verwerving en rechten Verwerving: aankoop 2-jun-2016 Copyright: Publiek domein",
 "img": "https://thumb.wikimedia.org/wikipedia/commons/thumb/4/47/Stereofoto_van_het_theater_in_Parijs_Mignon_transform%C3%A9e_%28titel_op_object%29%2C_RP-F-2016-51-4.jpg/1920px-Stereofoto_van_het_theater_in_Parijs_Mignon_transform%C3%A9e_%28titel_op_object%29%2C_RP-F-2016-51-4.jpg?utm_source=commons.wikimedia.org&utm_campaign=imageinfo&utm_content=thumbnail",
 "full": "https://upload.wikimedia.org/wikipedia/commons/4/47/Stereofoto_van_het_theater_in_Parijs_Mignon_transform%C3%A9e_%28titel_op_object%29%2C_RP-F-2016-51-4.jpg?utm_source=commons.wikimedia.org&utm_campaign=imageinfo&utm_content=original",
 "source": "https://commons.wikimedia.org/wiki/File:Stereofoto_van_het_theater_in_Parijs_Mignon_transform%C3%A9e_(titel_op_object),_RP-F-2016-51-4.jpg",
 "license": "CC0",
 "w": 4584,
 "h": 2502,
 "id": "STA-0865",
 "rect": "rect/864.jpg",
 "coll": "Rijksmuseum",
 "vert": 0.18,
 "rot": 0.04,
 "range": 4.76,
 "f": 0.75,
 "depth": "Deep",
 "va": 0.8858,
 "px": {
  "s": "https://thumb.wikimedia.org/wikipedia/commons/thumb/4/47/Stereofoto_van_het_theater_in_Parijs_Mignon_transform%C3%A9e_%28titel_op_object%29%2C_RP-F-2016-51-4.jpg/1920px-Stereofoto_van_het_theater_in_Parijs_Mignon_transform%C3%A9e_%28titel_op_object%29%2C_RP-F-2016-51-4.jpg?utm_source=commons.wikimedia.org&utm_campaign=imageinfo&utm_content=thumbnail",
  "ar": 0.8858,
  "L": [
   0.294792,
   0.0,
   0.138802,
   0.0,
   0.609733,
   0.172233
  ],
  "R": [
   0.287355,
   0.002322,
   0.508906,
   0.000279,
   0.609757,
   0.174437
  ],
  "g": [
   1.0,
   0.9623
  ]
 },
 "cond": "Rectified 2026. Halves registered to 0.18% vertical error and 0.04° of rotation. Depth measured deep (4.76% of frame width); hung in the VR Parlor at 75% size.",
 "repository": "Rijksmuseum",
 "collection_name": null,
 "publisher": null,
 "creator": null,
 "creator_dates": null,
 "facets": [
  "people",
  "world"
 ],
 "publisher_series": null,
 "date_edtf": "1867~",
 "date_start": 1862,
 "date_end": 1872,
 "rights_uri": "https://creativecommons.org/publicdomain/zero/1.0/",
 "rights_basis": "Source record carries a CC0 dedication (Wikimedia Commons license short name: CC0). Rights URI is the CC0 deed URL recorded from the source page.",
 "license_url": null,
 "source_page_id": 85227325,
 "source_revision_id": null,
 "source_sha1": "c9d8133406720cb74fb5d1658499dd374db31181"
}
