{
 "title": "Gezicht op de Untertorbrücke te Bern L'Ancien Pont à Berne, Suisse. (titel op object), RP-F-F08197",
 "place": "Switzerland",
 "year": "c. 1850",
 "sy": 1850,
 "era": "early",
 "cats": [
  "cities",
  "world"
 ],
 "blurb": "Identificatie Titel(s): Gezicht op de Untertorbrücke te Bern. L’Ancien Pont à Berne, Suisse. (titel op object) Objecttype: stereofoto Objectnummer: RP-F-F08197 Opschriften / Merken: nummer, recto: ‘364’ opschrift, recto, gedrukt: ‘Views of Switzerland, Savoy and Italy Photographed by W. England’ Vervaardiging Vervaardiger: fotograaf: William England (vermeld op object) Plaats vervaardiging: Bern Datering: ca. 1850 - ca. 1880 Fysieke kenmerken: albuminedruk Materiaal: karton fotopapier Techniek: albuminedruk Afmetingen: secundaire drager: h 85 mm × b 170 mm Onderwerp Wat: bridge Waar: Bern Verwerving en rechten Verwerving: overdracht van beheer 1994 Copyright: Publiek domein",
 "img": "https://thumb.wikimedia.org/wikipedia/commons/thumb/2/21/Gezicht_op_de_Untertorbr%C3%BCcke_te_Bern_L%27Ancien_Pont_%C3%A0_Berne%2C_Suisse._%28titel_op_object%29%2C_RP-F-F08197.jpg/1920px-Gezicht_op_de_Untertorbr%C3%BCcke_te_Bern_L%27Ancien_Pont_%C3%A0_Berne%2C_Suisse._%28titel_op_object%29%2C_RP-F-F08197.jpg?utm_source=commons.wikimedia.org&utm_campaign=imageinfo&utm_content=thumbnail",
 "full": "https://upload.wikimedia.org/wikipedia/commons/2/21/Gezicht_op_de_Untertorbr%C3%BCcke_te_Bern_L%27Ancien_Pont_%C3%A0_Berne%2C_Suisse._%28titel_op_object%29%2C_RP-F-F08197.jpg?utm_source=commons.wikimedia.org&utm_campaign=imageinfo&utm_content=original",
 "source": "https://commons.wikimedia.org/wiki/File:Gezicht_op_de_Untertorbr%C3%BCcke_te_Bern_L%27Ancien_Pont_%C3%A0_Berne,_Suisse._(titel_op_object),_RP-F-F08197.jpg",
 "license": "CC0",
 "w": 4732,
 "h": 2386,
 "id": "STA-1002",
 "rect": "rect/1001.jpg",
 "coll": "Rijksmuseum",
 "vert": 0.09,
 "rot": 0.0,
 "range": 0.43,
 "f": 1.0,
 "depth": "Gentle",
 "va": 0.8969,
 "px": {
  "s": "https://thumb.wikimedia.org/wikipedia/commons/thumb/2/21/Gezicht_op_de_Untertorbr%C3%BCcke_te_Bern_L%27Ancien_Pont_%C3%A0_Berne%2C_Suisse._%28titel_op_object%29%2C_RP-F-F08197.jpg/1920px-Gezicht_op_de_Untertorbr%C3%BCcke_te_Bern_L%27Ancien_Pont_%C3%A0_Berne%2C_Suisse._%28titel_op_object%29%2C_RP-F-F08197.jpg?utm_source=commons.wikimedia.org&utm_campaign=imageinfo&utm_content=thumbnail",
  "ar": 0.8969,
  "L": [
   0.348958,
   0.0,
   0.142969,
   0.0,
   0.771694,
   0.110021
  ],
  "R": [
   0.349442,
   0.000904,
   0.511599,
   -0.005884,
   0.773023,
   0.114155
  ],
  "g": [
   1.0,
   0.9624
  ]
 },
 "cond": "Rectified 2026. Halves registered to 0.09% vertical error and 0.0° of rotation. Depth measured gentle (0.43% of frame width); hung in the VR Parlor at full size.",
 "repository": "Rijksmuseum",
 "collection_name": null,
 "publisher": null,
 "creator": null,
 "creator_dates": null,
 "facets": [
  "cities",
  "world"
 ],
 "publisher_series": null,
 "date_edtf": "1850~",
 "date_start": 1845,
 "date_end": 1855,
 "rights_uri": "https://creativecommons.org/publicdomain/zero/1.0/",
 "rights_basis": "Source record carries a CC0 dedication (Wikimedia Commons license short name: CC0). Rights URI is the CC0 deed URL recorded from the source page.",
 "license_url": null,
 "source_page_id": 85248022,
 "source_revision_id": null,
 "source_sha1": "b188d33374b718ecd28bf50a62c4dd4e8f08bd50"
}
