{
 "title": "Prof. James D. Dana (NYPL b11707270-G89F328 015F)",
 "place": "California",
 "year": "Undated",
 "sy": 1900,
 "era": "undated",
 "cats": [
  "people"
 ],
 "blurb": "* by Lawrence & Houseworth and Thomas Houseworth & Co.",
 "img": "https://thumb.wikimedia.org/wikipedia/commons/thumb/c/c0/Prof._James_D._Dana_%28NYPL_b11707270-G89F328_015F%29.tiff/lossy-page1-1920px-Prof._James_D._Dana_%28NYPL_b11707270-G89F328_015F%29.tiff.jpg?utm_source=commons.wikimedia.org&utm_campaign=imageinfo&utm_content=thumbnail",
 "full": "https://upload.wikimedia.org/wikipedia/commons/c/c0/Prof._James_D._Dana_%28NYPL_b11707270-G89F328_015F%29.tiff?utm_source=commons.wikimedia.org&utm_campaign=imageinfo&utm_content=original",
 "source": "https://commons.wikimedia.org/wiki/File:Prof._James_D._Dana_(NYPL_b11707270-G89F328_015F).tiff",
 "license": "Public domain",
 "w": 3072,
 "h": 1735,
 "id": "STA-0523",
 "rect": "rect/522.jpg",
 "coll": "Robert N. Dennis Collection",
 "vert": 0.1,
 "rot": 0.02,
 "range": 1.6,
 "f": 1.0,
 "depth": "Moderate",
 "va": 0.862,
 "px": {
  "s": "https://thumb.wikimedia.org/wikipedia/commons/thumb/c/c0/Prof._James_D._Dana_%28NYPL_b11707270-G89F328_015F%29.tiff/lossy-page1-1920px-Prof._James_D._Dana_%28NYPL_b11707270-G89F328_015F%29.tiff.jpg?utm_source=commons.wikimedia.org&utm_campaign=imageinfo&utm_content=thumbnail",
  "ar": 0.862,
  "L": [
   0.341667,
   0.0,
   0.144531,
   0.0,
   0.70203,
   0.237546
  ],
  "R": [
   0.341537,
   -0.013927,
   0.537179,
   0.016297,
   0.703211,
   0.230293
  ],
  "g": [
   0.99,
   1.0
  ]
 },
 "cond": "Rectified 2026. Halves registered to 0.1% vertical error and 0.02° of rotation. Depth measured moderate (1.6% of frame width); hung in the VR Parlor at full size.",
 "repository": "New York Public Library",
 "collection_name": "Robert N. Dennis Collection of Stereoscopic Views",
 "publisher": null,
 "creator": null,
 "creator_dates": null,
 "facets": [
  "people"
 ],
 "publisher_series": null,
 "date_edtf": null,
 "date_start": null,
 "date_end": null,
 "rights_uri": "https://rightsstatements.org/vocab/NoC-US/1.0/",
 "rights_basis": "Source record marks the work public domain (Wikimedia Commons license short name: Public domain). Rights URI assigned by rule: RightsStatements.org No Copyright - United States (NoC-US).",
 "license_url": null,
 "source_page_id": 46798383,
 "source_revision_id": null,
 "source_sha1": "9bdc40e50509d72b7ad9e5b53934392e7b1ce40b"
}
