{
 "title": "East shore, from piazza of Kent House, by Walker, L. E., 1826-1916",
 "place": "Chautauqua Lake, New York",
 "year": "Undated",
 "sy": 1900,
 "era": "undated",
 "cats": [
  "oddities"
 ],
 "blurb": "",
 "img": "https://thumb.wikimedia.org/wikipedia/commons/thumb/7/7e/East_shore%2C_from_piazza_of_Kent_House%2C_by_Walker%2C_L._E.%2C_1826-1916.png/1920px-East_shore%2C_from_piazza_of_Kent_House%2C_by_Walker%2C_L._E.%2C_1826-1916.png?utm_source=commons.wikimedia.org&utm_campaign=imageinfo&utm_content=thumbnail",
 "full": "https://upload.wikimedia.org/wikipedia/commons/7/7e/East_shore%2C_from_piazza_of_Kent_House%2C_by_Walker%2C_L._E.%2C_1826-1916.png?utm_source=commons.wikimedia.org&utm_campaign=imageinfo&utm_content=original",
 "source": "https://commons.wikimedia.org/wiki/File:East_shore,_from_piazza_of_Kent_House,_by_Walker,_L._E.,_1826-1916.png",
 "license": "Public domain",
 "w": 2669,
 "h": 1646,
 "id": "STA-0210",
 "rect": "rect/209.jpg",
 "coll": "Source unrecorded",
 "vert": 0.09,
 "rot": 0.01,
 "range": 0.52,
 "f": 1.0,
 "depth": "Gentle",
 "va": 0.9877,
 "px": {
  "s": "https://thumb.wikimedia.org/wikipedia/commons/thumb/7/7e/East_shore%2C_from_piazza_of_Kent_House%2C_by_Walker%2C_L._E.%2C_1826-1916.png/1920px-East_shore%2C_from_piazza_of_Kent_House%2C_by_Walker%2C_L._E.%2C_1826-1916.png?utm_source=commons.wikimedia.org&utm_campaign=imageinfo&utm_content=thumbnail",
  "ar": 0.9877,
  "L": [
   0.416667,
   0.0,
   0.07526,
   0.0,
   0.684122,
   0.279983
  ],
  "R": [
   0.416996,
   -0.00707,
   0.513276,
   0.00889,
   0.687391,
   0.269632
  ],
  "g": [
   0.9921,
   1.0
  ]
 },
 "cond": "Rectified 2026. Halves registered to 0.09% vertical error and 0.01° of rotation. Depth measured gentle (0.52% of frame width); hung in the VR Parlor at full size.",
 "repository": null,
 "collection_name": null,
 "publisher": null,
 "creator": "Walker, L. E.",
 "creator_dates": "1826-1916",
 "facets": [
  "oddities"
 ],
 "publisher_series": null,
 "date_edtf": null,
 "date_start": null,
 "date_end": null,
 "rights_uri": "https://rightsstatements.org/vocab/NoC-US/1.0/",
 "rights_basis": "Source record marks the work public domain (Wikimedia Commons license short name: Public domain). Rights URI assigned by rule: RightsStatements.org No Copyright - United States (NoC-US).",
 "license_url": null,
 "source_page_id": 10055211,
 "source_revision_id": 1196799016,
 "source_sha1": "59fe2d7ba781e6269b98bbfb657ef86fff2e3751"
}
