{
 "title": "The Profile house, Franconia notch. Messrs. Taft, Taylor & Greenleaf, proprietors, by E. & H.T. Anthony (Firm)",
 "place": "Franconia Notch, New Hampshire",
 "year": "1863",
 "sy": 1863,
 "era": "early",
 "cats": [
  "mountains"
 ],
 "blurb": "",
 "img": "https://thumb.wikimedia.org/wikipedia/commons/thumb/9/94/The_Profile_house%2C_Franconia_notch._Messrs._Taft%2C_Taylor_%26_Greenleaf%2C_proprietors%2C_by_E._%26_H.T._Anthony_%28Firm%29.png/1920px-The_Profile_house%2C_Franconia_notch._Messrs._Taft%2C_Taylor_%26_Greenleaf%2C_proprietors%2C_by_E._%26_H.T._Anthony_%28Firm%29.png?utm_source=commons.wikimedia.org&utm_campaign=imageinfo&utm_content=thumbnail",
 "full": "https://upload.wikimedia.org/wikipedia/commons/9/94/The_Profile_house%2C_Franconia_notch._Messrs._Taft%2C_Taylor_%26_Greenleaf%2C_proprietors%2C_by_E._%26_H.T._Anthony_%28Firm%29.png?utm_source=commons.wikimedia.org&utm_campaign=imageinfo&utm_content=original",
 "source": "https://commons.wikimedia.org/wiki/File:The_Profile_house,_Franconia_notch._Messrs._Taft,_Taylor_%26_Greenleaf,_proprietors,_by_E._%26_H.T._Anthony_(Firm).png",
 "license": "Public domain",
 "w": 2689,
 "h": 1387,
 "id": "STA-0726",
 "rect": "rect/725.jpg",
 "coll": "Source unrecorded",
 "vert": 0.12,
 "rot": 0.0,
 "range": 0.75,
 "f": 1.0,
 "depth": "Gentle",
 "va": 1.499,
 "px": {
  "s": "https://thumb.wikimedia.org/wikipedia/commons/thumb/9/94/The_Profile_house%2C_Franconia_notch._Messrs._Taft%2C_Taylor_%26_Greenleaf%2C_proprietors%2C_by_E._%26_H.T._Anthony_%28Firm%29.png/1920px-The_Profile_house%2C_Franconia_notch._Messrs._Taft%2C_Taylor_%26_Greenleaf%2C_proprietors%2C_by_E._%26_H.T._Anthony_%28Firm%29.png?utm_source=commons.wikimedia.org&utm_campaign=imageinfo&utm_content=thumbnail",
  "ar": 1.499,
  "L": [
   0.403646,
   0.0,
   0.088281,
   0.0,
   0.522222,
   0.104545
  ],
  "R": [
   0.405278,
   -0.003969,
   0.508949,
   0.005841,
   0.525176,
   0.093585
  ],
  "g": [
   0.8173,
   1.0
  ]
 },
 "cond": "Rectified 2026. Halves registered to 0.12% vertical error and 0.0° of rotation. Depth measured gentle (0.75% of frame width); hung in the VR Parlor at full size.",
 "repository": null,
 "collection_name": null,
 "publisher": null,
 "creator": "E. & H.T. Anthony (Firm)",
 "creator_dates": null,
 "facets": [
  "mountains"
 ],
 "publisher_series": null,
 "date_edtf": "1863",
 "date_start": 1863,
 "date_end": 1863,
 "rights_uri": "https://rightsstatements.org/vocab/NoC-US/1.0/",
 "rights_basis": "Source record marks the work public domain (Wikimedia Commons license short name: Public domain). Rights URI assigned by rule: RightsStatements.org No Copyright - United States (NoC-US).",
 "license_url": null,
 "source_page_id": 7471407,
 "source_revision_id": null,
 "source_sha1": "75cce51d8d12c692e3613729613719f8e8fb0f12"
}
