{
 "title": "Grave of Thomas Clark, mate of the Mayflower, by William S. Robbins & Co. 2",
 "place": "Plymouth, Massachusetts",
 "year": "1865",
 "sy": 1865,
 "era": "early",
 "cats": [
  "oddities"
 ],
 "blurb": "",
 "img": "https://upload.wikimedia.org/wikipedia/commons/4/4b/Grave_of_Thomas_Clark%2C_mate_of_the_Mayflower%2C_by_William_S._Robbins_%26_Co._2.jpg?utm_source=commons.wikimedia.org&utm_campaign=imageinfo&utm_content=thumbnail_unscaled",
 "full": "https://upload.wikimedia.org/wikipedia/commons/4/4b/Grave_of_Thomas_Clark%2C_mate_of_the_Mayflower%2C_by_William_S._Robbins_%26_Co._2.jpg?utm_source=commons.wikimedia.org&utm_campaign=imageinfo&utm_content=original",
 "source": "https://commons.wikimedia.org/wiki/File:Grave_of_Thomas_Clark,_mate_of_the_Mayflower,_by_William_S._Robbins_%26_Co._2.jpg",
 "license": "Public domain",
 "w": 760,
 "h": 397,
 "id": "STA-0487",
 "rect": "rect/486.jpg",
 "coll": "Source unrecorded",
 "vert": 0.24,
 "rot": 0.0,
 "range": 8.64,
 "f": 0.31,
 "depth": "Deep",
 "va": 1.1885,
 "px": {
  "s": "https://upload.wikimedia.org/wikipedia/commons/4/4b/Grave_of_Thomas_Clark%2C_mate_of_the_Mayflower%2C_by_William_S._Robbins_%26_Co._2.jpg?utm_source=commons.wikimedia.org&utm_campaign=imageinfo&utm_content=thumbnail_unscaled",
  "ar": 1.1885,
  "L": [
   0.381579,
   0.0,
   0.099342,
   0.0,
   0.61461,
   0.059194
  ],
  "R": [
   0.379477,
   -0.001882,
   0.513422,
   0.005005,
   0.614043,
   0.060948
  ],
  "g": [
   0.8554,
   1.0
  ]
 },
 "cond": "Rectified 2026. Halves registered to 0.24% vertical error and 0.0° of rotation. Depth measured deep (8.64% of frame width); hung in the VR Parlor at 31% size.",
 "repository": null,
 "collection_name": null,
 "publisher": null,
 "creator": "William S. Robbins & Co.",
 "creator_dates": null,
 "facets": [
  "oddities"
 ],
 "publisher_series": null,
 "date_edtf": "1865",
 "date_start": 1865,
 "date_end": 1865,
 "rights_uri": "https://rightsstatements.org/vocab/NoC-US/1.0/",
 "rights_basis": "Source record marks the work public domain (Wikimedia Commons license short name: Public domain). Rights URI assigned by rule: RightsStatements.org No Copyright - United States (NoC-US).",
 "license_url": null,
 "source_page_id": 7446832,
 "source_revision_id": 1277692903,
 "source_sha1": "9a2073e1e3a0b4621e6cbc4f44bbc37dc570591f"
}
