{
 "title": "New Orleans Mardi Gras Stereo Card 1928 02",
 "place": "New Orleans, Louisiana",
 "year": "1928",
 "sy": 1928,
 "era": "late",
 "cats": [
  "oddities"
 ],
 "blurb": "\"When King Carnival reigns in the New Orleans, Mardi Gras, La.\" Parade, probably Rex, on Canal Street, New Orleans, Mardi Gras 1928",
 "img": "https://thumb.wikimedia.org/wikipedia/commons/thumb/9/92/New_Orleans_Mardi_Gras_Stereo_Card_1928_02.jpg/1920px-New_Orleans_Mardi_Gras_Stereo_Card_1928_02.jpg?utm_source=commons.wikimedia.org&utm_campaign=imageinfo&utm_content=thumbnail",
 "full": "https://upload.wikimedia.org/wikipedia/commons/9/92/New_Orleans_Mardi_Gras_Stereo_Card_1928_02.jpg?utm_source=commons.wikimedia.org&utm_campaign=imageinfo&utm_content=original",
 "source": "https://commons.wikimedia.org/wiki/File:New_Orleans_Mardi_Gras_Stereo_Card_1928_02.jpg",
 "license": "Public domain",
 "w": 5632,
 "h": 2757,
 "id": "STA-0376",
 "rect": "rect/375.jpg",
 "coll": "Source unrecorded",
 "vert": 0.08,
 "rot": 0.01,
 "range": 1.9,
 "f": 1.0,
 "depth": "Moderate",
 "va": 0.8889,
 "px": {
  "s": "https://thumb.wikimedia.org/wikipedia/commons/thumb/9/92/New_Orleans_Mardi_Gras_Stereo_Card_1928_02.jpg/1920px-New_Orleans_Mardi_Gras_Stereo_Card_1928_02.jpg?utm_source=commons.wikimedia.org&utm_campaign=imageinfo&utm_content=thumbnail",
  "ar": 0.8889,
  "L": [
   0.4,
   0.0,
   0.084115,
   0.0,
   0.919149,
   0.014362
  ],
  "R": [
   0.399427,
   -0.018954,
   0.525742,
   0.001127,
   0.921855,
   0.012204
  ],
  "g": [
   0.9913,
   1.0
  ]
 },
 "cond": "Rectified 2026. Halves registered to 0.08% vertical error and 0.01° of rotation. Depth measured moderate (1.9% of frame width); hung in the VR Parlor at full size.",
 "repository": null,
 "collection_name": null,
 "publisher": null,
 "creator": null,
 "creator_dates": null,
 "facets": [
  "oddities"
 ],
 "publisher_series": null,
 "date_edtf": "1928",
 "date_start": 1928,
 "date_end": 1928,
 "rights_uri": "https://rightsstatements.org/vocab/NoC-US/1.0/",
 "rights_basis": "Source record marks the work public domain (Wikimedia Commons license short name: Public domain). Rights URI assigned by rule: RightsStatements.org No Copyright - United States (NoC-US).",
 "license_url": null,
 "source_page_id": 86147451,
 "source_revision_id": 1057921899,
 "source_sha1": "4a8dcd21962e4de26b8683410e4145e0ed69807b"
}
