{
 "title": "Reppastølen, ca. 1905-1910.",
 "place": "Norway",
 "year": "c. 1905",
 "sy": 1905,
 "era": "late",
 "cats": [
  "mountains",
  "world"
 ],
 "blurb": "Identifier: SFFf-1988009.288494 Description: Reppastølen mountain farm. The mountains in the background are Skjeldestadåsen, Stedjeåsen og Storehaugen. The milkmaids are Stina Reppen og Sofia Bjørkum. Medium: Glass plate negative. Extent: 13 x 18 cm. Photographer: Nils Olsson Reppen.",
 "img": "https://thumb.wikimedia.org/wikipedia/commons/thumb/8/86/Reppast%C3%B8len%2C_ca._1905-1910..jpg/1920px-Reppast%C3%B8len%2C_ca._1905-1910..jpg?utm_source=commons.wikimedia.org&utm_campaign=imageinfo&utm_content=thumbnail",
 "full": "https://upload.wikimedia.org/wikipedia/commons/8/86/Reppast%C3%B8len%2C_ca._1905-1910..jpg?utm_source=commons.wikimedia.org&utm_campaign=imageinfo&utm_content=original",
 "source": "https://commons.wikimedia.org/wiki/File:Reppast%C3%B8len,_ca._1905-1910..jpg",
 "license": "No restrictions",
 "w": 6487,
 "h": 3831,
 "id": "STA-0937",
 "rect": "rect/936.jpg",
 "coll": "Source unrecorded",
 "vert": 0.07,
 "rot": 0.0,
 "range": 1.72,
 "f": 1.0,
 "depth": "Moderate",
 "va": 1.0468,
 "px": {
  "s": "https://thumb.wikimedia.org/wikipedia/commons/thumb/8/86/Reppast%C3%B8len%2C_ca._1905-1910..jpg/1920px-Reppast%C3%B8len%2C_ca._1905-1910..jpg?utm_source=commons.wikimedia.org&utm_campaign=imageinfo&utm_content=thumbnail",
  "ar": 1.0468,
  "L": [
   0.430729,
   0.0,
   0.03099,
   0.0,
   0.696649,
   0.292328
  ],
  "R": [
   0.4348,
   -0.023578,
   0.550363,
   0.002416,
   0.70357,
   0.281813
  ],
  "g": [
   0.9418,
   1.0
  ]
 },
 "cond": "Rectified 2026. Halves registered to 0.07% vertical error and 0.0° of rotation. Depth measured moderate (1.72% of frame width); hung in the VR Parlor at full size.",
 "repository": null,
 "collection_name": null,
 "publisher": null,
 "creator": null,
 "creator_dates": null,
 "facets": [
  "mountains",
  "world"
 ],
 "publisher_series": null,
 "date_edtf": "1905~",
 "date_start": 1900,
 "date_end": 1910,
 "rights_uri": null,
 "rights_basis": "Source record is marked 'No restrictions' (Wikimedia Commons license short name): a no-known-copyright-restrictions statement (Flickr Commons usage terms; the exact URL is in license_url). No RightsStatements.org URI was assigned, because that label is not a public-domain determination.",
 "license_url": null,
 "source_page_id": 34740745,
 "source_revision_id": null,
 "source_sha1": "39d0aeeae72a501098fb758fcbbd9cb5a7a8b051"
}
