{
 "title": "Profile Lake, Franconia Notch, N.H (NYPL b11708043-G91F019 169F)",
 "place": "Franconia Notch, New Hampshire",
 "year": "Undated",
 "sy": 1900,
 "era": "undated",
 "cats": [
  "water",
  "mountains"
 ],
 "blurb": "* by Kilburn Brothers and B.W. Kilburn.",
 "img": "https://thumb.wikimedia.org/wikipedia/commons/thumb/c/cc/Profile_Lake%2C_Franconia_Notch%2C_N.H_%28NYPL_b11708043-G91F019_169F%29.tiff/lossy-page1-1920px-Profile_Lake%2C_Franconia_Notch%2C_N.H_%28NYPL_b11708043-G91F019_169F%29.tiff.jpg?utm_source=commons.wikimedia.org&utm_campaign=imageinfo&utm_content=thumbnail",
 "full": "https://upload.wikimedia.org/wikipedia/commons/c/cc/Profile_Lake%2C_Franconia_Notch%2C_N.H_%28NYPL_b11708043-G91F019_169F%29.tiff?utm_source=commons.wikimedia.org&utm_campaign=imageinfo&utm_content=original",
 "source": "https://commons.wikimedia.org/wiki/File:Profile_Lake,_Franconia_Notch,_N.H_(NYPL_b11708043-G91F019_169F).tiff",
 "license": "Public domain",
 "w": 3072,
 "h": 1699,
 "id": "STA-0690",
 "rect": "rect/689.jpg",
 "coll": "Source unrecorded",
 "vert": 0.14,
 "rot": 0.06,
 "range": 0.48,
 "f": 1.0,
 "depth": "Gentle",
 "va": 1.8576,
 "px": {
  "s": "https://thumb.wikimedia.org/wikipedia/commons/thumb/c/cc/Profile_Lake%2C_Franconia_Notch%2C_N.H_%28NYPL_b11708043-G91F019_169F%29.tiff/lossy-page1-1920px-Profile_Lake%2C_Franconia_Notch%2C_N.H_%28NYPL_b11708043-G91F019_169F%29.tiff.jpg?utm_source=commons.wikimedia.org&utm_campaign=imageinfo&utm_content=thumbnail",
  "ar": 1.8576,
  "L": [
   0.332813,
   0.0,
   0.147656,
   0.0,
   0.323917,
   0.425141
  ],
  "R": [
   0.335179,
   -0.002012,
   0.508437,
   0.004104,
   0.326479,
   0.418241
  ],
  "g": [
   1.0,
   0.9929
  ]
 },
 "cond": "Rectified 2026. Halves registered to 0.14% vertical error and 0.06° of rotation. Depth measured gentle (0.48% of frame width); hung in the VR Parlor at full size.",
 "repository": null,
 "collection_name": null,
 "publisher": null,
 "creator": null,
 "creator_dates": null,
 "facets": [
  "water",
  "mountains"
 ],
 "publisher_series": null,
 "date_edtf": null,
 "date_start": null,
 "date_end": null,
 "rights_uri": "https://rightsstatements.org/vocab/NoC-US/1.0/",
 "rights_basis": "Source record marks the work public domain (Wikimedia Commons license short name: Public domain). Rights URI assigned by rule: RightsStatements.org No Copyright - United States (NoC-US).",
 "license_url": null,
 "source_page_id": 49711432,
 "source_revision_id": null,
 "source_sha1": "de356a33469d12cb801de73d568c78b4018d6e9e"
}
